id,query,response,responded_at,user_id
463,"how to contact "" one day one minute media!?","i don't have access to personal information like contact details of event organizers. however, you can reach out to the event organizers through their official website or social media handles. they will be able to provide you with the necessary details or direct you to the right person to contact. good luck! 😊",2024-03-20 09:01:45.072 +0530,7201
545,yeah im from vadavalli can i know what is the bus timing from there and timing,"i'm glad to hear that you're interested in yugam! unfortunately, i'm a large language model, i don't have access to real-time bus schedules or timings. however, you can check the official yugam website or social media handles for the latest updates on bus schedules and timings. additionally, you can use public transportation apps like google maps or moovit to plan your trip to yugam. have a great day!",2024-03-20 19:03:08.035 +0530,10873
748,share me the schedule of today's yugam,"i don't have access to the detailed schedule of today's events. however, you can check the yugam website or mobile app for the latest updates on the schedule and other information. have a great day! 😊",2024-03-21 14:42:08.071 +0530,6218
840,"me and my team cannot reach kumaraguru college in acutal time because of our native distance. so, can you please refund our amount ?","barath. unfortunately, i cannot provide a refund for the event as it is an in-person event and cannot be transferred to an online platform. however, i can suggest that you and your team can still participate in the event by streaming it online or by watching the recorded videos of the event after it takes place. this way, you can still be a part of the event and enjoy it from the comfort of your own space. additionally, you can also reach out to the event organizers and request them to provide a refund or a credit for the event, which they may consider. i hope this helps!",2024-03-22 14:38:38.832 +0530,11646
918,can we attend extra 80 events of yugam next day after the participated event is completed,"i'm sorry, manoj, but you can not attend any extra events the following day after participating in an event at yugam. according to the terms and conditions of yugam, participants are only allowed to attend events on the specified dates and times. please check the yugam schedule for the most up-to-date information on events and their schedules.",2024-03-23 06:11:47.925 +0530,9146
919,will the money refunded if we won't attend the event on the particular day,"i'm sorry, but according to the information provided, tickets are non-transferable and non-refundable. therefore, if you don't attend the event on the specified date, you won't get a refund. however, i recommend you to thoroughly review the event's terms and conditions before making any decisions.",2024-03-23 06:13:51.369 +0530,9146
1044,when the certificates for events will be received date,"thank you for your interest in yugam! 
     unfortunately, i don't have access to the specific information you requested. the certificates for events are typically provided after the event has concluded, and the details of when and how they will be received are usually communicated through the event organizer or registration platform.
     i recommend keeping an eye on your email and any other communication channels provided by the event organizer for updates on the certificates.
     have a great day!",2024-03-24 19:33:18.119 +0530,9323
